cid,text,time,author,channel,votes,photo,heart
Ugx12e2TQ-UTFkfx66l4AaABAg,"I like this roasting, it's funny, informative and eye opening for many folks outhere, who are looking for a side hustle to make some extra cash. 😀",10 個月前,Marketing Harry,UC8bbeohnLzmsGPklJCSFpRQ,1,https://yt3.ggpht.com/ytc/AKedOLRln_BhMvQOXWSBIi9D3k5HZrXI-ayGBJWdJQmz=s176-c-k-c0x00ffffff-no-rj,0.0
UgzCz5oJ-v2S1dyiVaJ4AaABAg,This is an indication at what level a large part of the TikTok audience is at.,10 個月前,Bee,UCaqhMc1US0upANNtS-ceFzQ,0,https://yt3.ggpht.com/QPDfre3oa9e5kDklGfT4RlzB9LSOqd0vM5xXqHESjrFuhzSjeU-sDkrilS7ZEncgpdVmwlzKjB4=s176-c-k-c0x00ffffff-no-rj,0.0
UgxR8oD7p1aDJPoyQ2B4AaABAg,So this was a channel I subscribed to. I liked it better when you were producing quality content instead of roasting TikTok gurus for views.,10 個月前,Matt Baran,UC9tfZaAMsCsUf68IpqfP9SQ,1,https://yt3.ggpht.com/ytc/AKedOLSFbYhLCR3cKFGSTxYDzJz2uxaLa90FpLkQjQpWVg=s176-c-k-c0x00ffffff-no-rj,0.0
Ugz_7fhv4nxhtRKKCVF4AaABAg,7:36 - this guy imitating Gary Vee (and pretending to talk to someone else while doing it) 😂,10 個月前,Jack Duffley,UC_g4GptJd1A5vzfu2CR4dRw,12,https://yt3.ggpht.com/ytc/AKedOLQrg-XDM0idHqxiicj7MGDpOr8Eji91G4YfAwaoLlA=s176-c-k-c0x00ffffff-no-rj,0.0
UgwMyKEPot5xCpVeje94AaABAg,Love it!! Keep them coming :),10 個月前,mehdi jouay,UCxKvno38Sec_2dqA5eA_E0w,0,https://yt3.ggpht.com/ytc/AKedOLTD1XKmvRkNvuG8UZi63KqCzYgN2B05fBEMIjhX6A=s176-c-k-c0x00ffffff-no-rj,0.0
UgzvISO_5d0tlgFMijd4AaABAg,"I’m an entrepreneur. I don’t work 9-5.
I work 8-22, 24/7.
That’s what these charlatans don’t tell you",10 個月前,Guz Man,UCU8zPngoj_iKMQHLwOb99eA,1,https://yt3.ggpht.com/ytc/AKedOLQKo6BKpOdtEQLYBBzbgXVicFu1IU5kfMeBf0kM=s176-c-k-c0x00ffffff-no-rj,0.0
UgisI7WnHA53ZngCoAEC,Godzilla quoted this once. ,7 年前,TazzReviews,UC_qVfSw_Z2Rlf0yvYNc5hcg,380,https://yt3.ggpht.com/zDY706coXo_e6FNt6fxMJVMPB6RqyHrtDb3buuI3xWFB2CqVKuO7PMD57k3NV7hotak33j6c=s176-c-k-c0x00ffffff-no-rj,0.0
UgwUDEZXpx-6HXXLcDB4AaABAg,"Humanity: We need Kong. The world needs him.




Godzilla:",1 年前,Lion Angel,UC2L7b6rD_gVY2lZTWToW5VQ,26,https://yt3.ggpht.com/ytc/AKedOLQqMc_tg6EcybVVn03TMSok3ErkXZQOKZ-WTSPj=s176-c-k-c0x00ffffff-no-rj,0.0
Ugw28D1OSVKDNPwvAdV4AaABAg,"If nobody says that in Godzilla vs Kong, I'm done with life.",3 年前,bro,UCYqO5r6f8Xoh9bbbbAVRu2g,37,https://yt3.ggpht.com/N_7ph9f8MTH7EV50qhYrGDcLxQsZg54RBlwlJZEw9KBETRo4e9jRTUAzSq5U0AqrerlP01eN=s176-c-k-c0x00ffffff-no-rj,0.0
UgjHV3SfUBvDn3gCoAEC,When people think King Kong has shit on you.,6 年前,Adwin Galo,UCmUyDSCF51NAcf3gmjFjrSg,104,https://yt3.ggpht.com/ytc/AKedOLTvcmnz_6Xi70OjcBjddEHH1PxLPPGgkugX4Q7Xzg=s176-c-k-c0x00ffffff-no-rj,0.0
UggPcZhLgYaRpngCoAEC,He deserves an oscar for that scene,6 年前,Iggy Pips,UCTfF5n7BidDt6LnYY7pz9tw,28,https://yt3.ggpht.com/ytc/AKedOLRDZS2MnDuYAbuDAWQU9ROLAPLPT8wbLRawnBd7mg=s176-c-k-c0x00ffffff-no-rj,0.0
Ugh2u8tiYv78fXgCoAEC,The exact moment when Denzel Washington wins the Academy Award!,5 年前,Alexander George,UCcmnSpU-EJyPR9hTxCl8Bog,6,https://yt3.ggpht.com/ytc/AKedOLTPSolTTU4-nm2Hc8rRdVapyGzHVIpvi1o-jw=s176-c-k-c0x00ffffff-no-rj,0.0
UgxKlkmXUc7IuHa59dZ4AaABAg,I love this scene in the movie.  Really powerful.,13 年前,krakhaid,UC6zftblqWlwRCENw6BqdD9w,2,https://yt3.ggpht.com/ytc/AKedOLRp7xnBP-w8-PkhMoikXzES7UFprAEFK6tbHA=s176-c-k-c0x00ffffff-no-rj,0.0
UghZi_SoD9QncHgCoAEC,me when i pass my math exam unexpectedly,7 年前,Alan Nigenda,UCJhj-O3-OSiVKRrkFSyfhtQ,135,https://yt3.ggpht.com/ytc/AKedOLTh7S9AWINaSNVeLgZlH53ToizoSJ3kMhszsGKLjg=s176-c-k-c0x00ffffff-no-rj,0.0
UgjbZlFRaECinHgCoAEC,Denzel is awesome in everything love all his movies,8 年前,TheGamerPandA,UCFXkWgf9Nwu7nHtdPWgkzTQ,9,https://yt3.ggpht.com/ytc/AKedOLTFflASXAicqGxqprMIRDtxCZnjlb3Jfe2zR4Ku=s176-c-k-c0x00ffffff-no-rj,0.0
UgwcOzKPTdMviS1xlOV4AaABAg,Damn.. I watch training day once every last day of the month and i still get chills because of how epic that part is. I literally see the whole movie again just to see his wife naked and to see this part. haha,11 年前,FOOKIN HALE,UCmLDP74rmg_6RGif7fq8mvQ,0,https://yt3.ggpht.com/ytc/AKedOLSzI4MvXKwUesXpwdBBiME_m0iGNLp0GoD5ZMj_ug=s176-c-k-c0x00ffffff-no-rj,0.0
UgzVISW8fl8kUl-cnRN4AaABAg,"""King Kong ain't got shit on me""
 Famous last words 😭",10 個月前,Lucas Dante,UC1Hmf7wHXGtK8tHXuowo3SQ,1,https://yt3.ggpht.com/btHoWNGQK0yWYoMyDraO8lXginhl0dfM3DYAmAGbjDi4a-R8NCUTfZA1UBDlWTJnMhTBQqW3rIA=s176-c-k-c0x00ffffff-no-rj,0.0
UgzB0QeN2aBg1z2OPRB4AaABAg,"I love this guy,  he is my hero
",9 年前,Tim Harman,UC8LKPQXI2Bi8PLldUdj6cSg,0,https://yt3.ggpht.com/ytc/AKedOLQBybuA7eDQYvmVCKWniddBl7ukPu6YAwtNFTujZA=s176-c-k-c0x00ffffff-no-rj,0.0
UgggrFYeqS9I1ngCoAEC,"Press 2, and after he says, ""King Kong,"" quickly press 6.",7 年前,JonW1987,UC8i9M7yKGFHiQXjR_icyH-g,225,https://yt3.ggpht.com/ytc/AKedOLQjGD3zZHHPIa2EeFI31DgRgV7jGMQVsReQ2KBE=s176-c-k-c0x00ffffff-no-rj,0.0
UgjtQogqEOCLcngCoAEC,"The so called over the top scene is the best part of the movie. ""King Kong ain't got shit on me""",7 年前,Abeyl Genet,UCeptyzMOHRYV-G7aLMfLQhg,3,https://yt3.ggpht.com/ytc/AKedOLQ_63TMlK4cE1DnTNhWGtsXEHfkIcxwhGhXZQ=s176-c-k-c0x00ffffff-no-rj,0.0
UgxHP63m5z8pElY9T054AaABAg,Working a 12 hour shift on just two hours of sleep like:,3 年前,CLD 7991,UCzYqMI3BirAhMEyQ9wHD7kA,7,https://yt3.ggpht.com/ytc/AKedOLSC3UXAFwv3rTsk1I46HHgLvcuacyUKhyJoWznk=s176-c-k-c0x00ffffff-no-rj,0.0
UghNKkXqsZmeBHgCoAEC,"King Kong got shit on me once. You need to make sure you're standing REALLY far away when he does it, it splashes EVERYWHERE.",7 年前,CharginChuck,UCTZxuiALgfzivd0CcfYRUMg,2,https://yt3.ggpht.com/1DNHcyDBmV9xUWmoljn_pxREsEDA3nXqpIIUN2iDbKV0GJnaTBr-0wVXosD1De0PsDJcvlZL=s176-c-k-c0x00ffffff-no-rj,0.0
Uggpx7cJ2W2Gf3gCoAEC,My workout quote!  lol ,8 年前,Coach Rollie Workouts - Fat X 101,UCkqBGyoTxXSaWT8MojeU3Mg,26,https://yt3.ggpht.com/ytc/AKedOLRCVsIWZTTVOmYQbmrTtdwm98yH_yDY5Rig-sMY=s176-c-k-c0x00ffffff-no-rj,0.0
Uggr2NXGakx3engCoAEC,Godzilla's thoughts Exactly,5 年前,Plebdominus Rex,UCtNN93N6YgwQX7rczlfL0lA,136,https://yt3.ggpht.com/ytc/AKedOLRpiIjFjzQkPKTpr_uUbc6fvzib4dPlxiaNGWREgw=s176-c-k-c0x00ffffff-no-rj,0.0
UghLWH7i8X1e5HgCoAEC,"So glad that ""King Kong"" line earned Denzel an Oscar for Best Actor.",5 年前,Esteban68 Hernandez,UCOAMUyuY2QXGUBIXLnKCWFw,0,https://yt3.ggpht.com/ytc/AKedOLQ4VwnnyP1dTFmOTIn98bzv_es-jGp0bEVz7w=s176-c-k-c0x00ffffff-no-rj,0.0
UgwVGg-se3QcA97ZJ-d4AaABAg,When you beat the final boss in Dark Souls,3 年前,Alex K,UCrNfLrb4pEUoH6uIog-1dcw,8,https://yt3.ggpht.com/5b0mVK-sBqJ1pKpgqKH2T6w9NwYURWl3Q5cP5VU2AocuYcxjjYnlxYYGEJk9xOPRtQIfd8v0sA=s176-c-k-c0x00ffffff-no-rj,0.0
UgyiY8iMS7sjnISgsll4AaABAg,Pretty awesome that you support side hustles as a business owner! Not to mention showcasing their side hustles on your channel to help them get some exposure is really pretty incredible. Keep up the great work Noah.,10 個月前 (已編輯),Mike Nardi,UCLSXOwjIhyU67QuIvt51dbQ,55,https://yt3.ggpht.com/ytc/AKedOLRRGR9gfxeF-oy0oFwsKu08CyZZe3y1thZCmdcwxA=s176-c-k-c0x00ffffff-no-rj,0.0
UgxJ4qW86L0nMPSOxS54AaABAg,Make sure you protect your health for side hustle (and full time) energy!,10 個月前,fitforfreelance,UCtgEdA6SI71YpR0fHM_jx7Q,3,https://yt3.ggpht.com/6dVdPknBl9ifd7QLjfFR5D1p6sWt5UGsurMTI3wMj6R17x1L2GHjN2hZqhWfMAWBvsMT_ByvBrk=s176-c-k-c0x00ffffff-no-rj,0.0
UgwPG4wpgw7pQQ2y1XJ4AaABAg,"3:07 ""it is a tongue that is delicious...""

Don't mix personal life and business Noah!",10 個月前,Matt Phelps,UCrhM0tPz7bFPV5I3tPF-TVw,3,https://yt3.ggpht.com/p3vGCy8AIi4Y-mJJMJTTFfNQjrxcb5iDgBysc3tJc5CBr3s1pdGg1Wt6MtZIr3MYI9ZqGs0Eu_Y=s176-c-k-c0x00ffffff-no-rj,0.0
UgwSqtH96x-qSVzDFSh4AaABAg,Thank you 🙏🏻 🤩 I love my day job but building my side hustle is so important to me to . Thank you x,8 個月前,Isabelle Mettan-Ure,UCC17Ph-fL2iuNKurvSojWYw,1,https://yt3.ggpht.com/ytc/AKedOLRF7-MuimVYigDYPpDo_vTn85JmCoTopT8QIQ=s176-c-k-c0x00ffffff-no-rj,0.0
Ugz_13tl8Na9_1_ecEV4AaABAg,"I got an idea for your next video! 
Help one of your employees (or anyone who is procrastinating) start a side hustle in a weekend!",10 個月前,Robby Goodwin,UCB3wA06Wvh1DnJjGnBGgq1g,3,https://yt3.ggpht.com/ytc/AKedOLTIj0l7uMzbX6CffvwkjMKcjyGJgbyS8WPiDSUj=s176-c-k-c0x00ffffff-no-rj,0.0
Ugz7ydQfCYqSG2FQwVx4AaABAg,"Great hat and shirt!!!

Oh and great content too, but that’s a given :)",10 個月前,Jen Tankel,UCneW8sFIy373o8f1eCk8NTQ,1,https://yt3.ggpht.com/ytc/AKedOLQJ9j3Mu2YMI8SEOEjLWbeYvQS5YOCFWFY90w=s176-c-k-c0x00ffffff-no-rj,0.0
Ugy2I8DPM0gqk94SKwl4AaABAg,Love these kind of videos! Uncle Noahh,10 個月前,Marianne H K,UCd9OKoyfUwrQ2B9_eTkOlow,1,https://yt3.ggpht.com/ytc/AKedOLR2I6cxCDALfHelSlToDNeWRy1J2IsPXNoUKQ=s176-c-k-c0x00ffffff-no-rj,0.0
Ugzthz3wycfRo_za21p4AaABAg,"I feel like you,man, carve my own Path, But , you pay a bit price.love from Portugal 🇵🇹🇵🇹🇵🇹 parabéns 😁",2 天前,john pinheiro,UCGO8cJ-X0eygiBHpTNI4-QQ,0,https://yt3.ggpht.com/ytc/AKedOLQcrfMgXIn60F8GTbT5mY1iSTccizIi44WPoA=s176-c-k-c0x00ffffff-no-rj,0.0
Ugy4huKrfE-U-kn143p4AaABAg,I appreciate you a lot much more now Noah for putting a light on their side hustles 🙌✨,10 個月前 (已編輯),Mohamed Alsharweni,UCRHcGm_uCEqpVDaQzM1eBjA,2,https://yt3.ggpht.com/ytc/AKedOLTCdEmWckXlG9LXvlH73Oj4SbSFMw9_-8CEOr4xFg=s176-c-k-c0x00ffffff-no-rj,1.0
Ugx5nNMUV6lUFnF3zz94AaABAg,Ur videos r so good I'm binge-watching them like Netflix :)!,10 個月前,mehdi jouay,UCxKvno38Sec_2dqA5eA_E0w,0,https://yt3.ggpht.com/ytc/AKedOLTD1XKmvRkNvuG8UZi63KqCzYgN2B05fBEMIjhX6A=s176-c-k-c0x00ffffff-no-rj,0.0
Ugyu1yshRBlCuBXi6nV4AaABAg,"You’re like the dream boss, i’ll never have😔",10 個月前,Yannick Nixon,UCT89GFYRJILIYiwZki80sUQ,0,https://yt3.ggpht.com/ytc/AKedOLRO4SKiEHkB2cv792f6AFXjioyIfGCSJ7t67GqSNg=s176-c-k-c0x00ffffff-no-rj,0.0
Ugw6DqBATSVL6wsGU5t4AaABAg,very inspiring and cool to hear about other's side hustles,10 個月前,Mia's Money,UCXAf0-NJhaRAr6Wt_75SKBA,0,https://yt3.ggpht.com/U0hrkqymf_oGmcVEJ6fY5fwaZos6Tx3YBZMYxdb58biRICjyWSQhitZymA0UFn5E3WGjdi_EAQ=s176-c-k-c0x00ffffff-no-rj,0.0
UgyDNPHq8pQtpw2v4Bx4AaABAg,Outstanding! And I'm not just talking about the Taco Derby shirt.,10 個月前,Jeremy Hall,UCpxi8F7Q_d-r3aSR0-CMzHA,1,https://yt3.ggpht.com/ytc/AKedOLTrgnQ9Rjqb2O4IxlBoVeLz2SczizUUuW1OwDTV_w=s176-c-k-c0x00ffffff-no-rj,0.0
UgyRzCUdAZcx7Z_KGPF4AaABAg,thats so ENTP! great leadership!,10 個月前,Valera Ivanov,UCYucwis_2e9EdW2Pr7IeI3g,0,https://yt3.ggpht.com/ytc/AKedOLSrNFm9Rh9Ukt2x6le4poGDTFFniTF8Ns6i-MRs=s176-c-k-c0x00ffffff-no-rj,0.0
UgyAZShkcxY-IVje-jx4AaABAg,This was great Noah. Thank you. Always solid tips.,10 個月前,My Digital Marketing Journey,UCKikkvJZqmhgpEe6RlG1rUA,0,https://yt3.ggpht.com/ytc/AKedOLSD1Mr2zZljFgYkf16f4rRpiS9WWDSR0_znxIw8=s176-c-k-c0x00ffffff-no-rj,0.0
UgxxZKv-o5tnRgavExl4AaABAg,💥Full of value again noah thank you. I will try the side hustle a share my experience online all thanks to you ✅✅✅,10 個月前,Reza Muradi,UC4O6IYpy0yMk93-8PZAxpxQ,1,https://yt3.ggpht.com/gJsDNN6GTrZz_XVnkS4UTR8AjbnMQPeZEFP0HgVCk7l_8o-X4_NXsva4lyfFQc9DKdOQkmHuYQ=s176-c-k-c0x00ffffff-no-rj,0.0
UgzSeO-8aLNo0az2MeV4AaABAg,Uncle noah videos are amazing hahaha,10 個月前,Ameer Baig,UC2SlBN8eM8Gchj6ZhyOxePA,1,https://yt3.ggpht.com/ytc/AKedOLTYLedW4HYgDP8JpaB29X3RfdnFK_Ty8mxUx8WgBw=s176-c-k-c0x00ffffff-no-rj,0.0
Ugy-GEqoCBuGXbnhE9R4AaABAg,Great video!,10 個月前,Pranav,UCcu3WpTdKSHd3zdeYTWWNqw,0,https://yt3.ggpht.com/ytc/AKedOLRmnT0oEXknSa31Z5AJkO3ED_uF7q1mNyss8R5Vqw=s176-c-k-c0x00ffffff-no-rj,0.0
Ugxyrd9VK5dTSZm2OCh4AaABAg,"Hey Noah, absolutely LOVE YOUR CHANNEL!!... I wish you could do a video on how you and your team/teams build the various API softwares that powers your present and past sites...The whole idea of ACTUALLY building API’s for a  business is soooooo confusing to me... no matter how many vids I watch on the subject, I can’t find a video with practical common language explanation...smdh... it might be too time consuming for you to do, but it would be THE highlight of my YouTube experience!!",10 個月前,Money Making Sim,UC-Lx1Bx2aQ1h7D1UXDuXGLA,2,https://yt3.ggpht.com/xhcE7HIEXG-o4OiZajKk6K2-WmZWEYCMv7KcERubX42TQnxEFc7alPlJVB5UkBUp95uOopGbcw=s176-c-k-c0x00ffffff-no-rj,0.0
UgyHa5shEuSGM2NlON94AaABAg,"Good on you, Noah!!",10 個月前,DP,UCjvLXw-EN1RyJDD5TrvQ5jg,0,https://yt3.ggpht.com/ytc/AKedOLSWyi8St6M6eHvoS31PHYrqL4mlYUI8C__2JSn0=s176-c-k-c0x00ffffff-no-rj,0.0
Ugxb6VwrdUr0RzH9NOR4AaABAg,Noah Can you make a video on side hustles teenagers can do❓,8 個月前,Reza Muradi,UC4O6IYpy0yMk93-8PZAxpxQ,25,https://yt3.ggpht.com/gJsDNN6GTrZz_XVnkS4UTR8AjbnMQPeZEFP0HgVCk7l_8o-X4_NXsva4lyfFQc9DKdOQkmHuYQ=s176-c-k-c0x00ffffff-no-rj,0.0
UgzW8nnwp0saIvUOYAN4AaABAg,As a full time headhunter (executive search for healthcare) it was cool that he mentioned that. And yes the fees are massive. We charge clients 30% of the first years compensation.,8 個月前,Nick S.,UC2ROeDAomHZDSHXrBRhyLKQ,3,https://yt3.ggpht.com/12hPTJyUVaRr5icFI_ohe-5GZlnFtqkgRe-bBFWv0KQGOfoBMw1B73KHILCAcPBCKuaEWXhEHw=s176-c-k-c0x00ffffff-no-rj,0.0
UgwkEw6khFCYi4BZN-B4AaABAg,"Thanks Noah!!! I needed a push. 

Started a course today that is centered around emotions, thinking, and physiology. Only done one video for it (on procrastination) haha. I recommend that everyone get involved in Noah's challenge. I started the day in a big low and now that I done what I could to start (wasn't up to my standards) I feel like I have a breath of fresh air. Thanks Noah! 

P.S. The reason I was feeling low was because I didn't have a reason to go through my resources around emotions and physiology. Then when Noah mentioned the challenge I thought, well what problem of my own can I fix?",8 個月前 (已編輯),stefan sigley,UC7_yPIs144CVLD6IeeXC5MA,9,https://yt3.ggpht.com/ytc/AKedOLR1HQ23PnGTe_BW8huTzKwvb0E-8CAjbd-415mTNw=s176-c-k-c0x00ffffff-no-rj,0.0
UgwW1Lr5-XfIorXv78F4AaABAg,"Great Video! 
My partner is a culinary chef with a degree in pastry.
She has found a lot of success this year on FB marketplace AND all of the people have to order a minimum and pick up only so its super convenient for her. 
It works really well.",8 個月前,TheAntipreneur,UC_dqgo1D5VWJmaIGf-BpH8Q,11,https://yt3.ggpht.com/f6wh_FAtG7jcvT0JUdUHmN1w-HOA0xQECNQtEUaBgd47cLIvRuLwLKWYvQ1N7b6l3GJQicq_7Q=s176-c-k-c0x00ffffff-no-rj,0.0
Ugz8wBsSdqU_u0Hznih4AaABAg,"Great video, Noah, as always!   Do you have a transcript link for the video?   Also, would like to know more specific details about how to set up virtual events for companies.   Please share and thanks!",8 個月前,Jayne Terry,UCjHWj6P-TJ-Ig66O3EvcgsQ,2,https://yt3.ggpht.com/ytc/AKedOLT16ac0gcz3r8uqCSRmc1spucWies2S8lwU0w=s176-c-k-c0x00ffffff-no-rj,0.0
UgzOybFjEJQUoaHMKXx4AaABAg,An in depth video about email marketing side hustle would be amazing 🔥,8 個月前,Dorian Hahl,UCfL293Ck8bRgioDAB1YsJiA,25,https://yt3.ggpht.com/ytc/AKedOLRM_5b8g-mdjMRrwuuYU0gir43cyzdgFJDx8g=s176-c-k-c0x00ffffff-no-rj,0.0
UgxrVXwxeVJ0mhyMXWp4AaABAg,It would really be great if you put timestamps on your list videos. It makes the user experience so much better.,8 個月前,Train of Taught,UCAuo0a-X3_tLGO2E-Zn0x8Q,10,https://yt3.ggpht.com/ytc/AKedOLQZVfOZIi6P5Xgk2Gaf3hH_Dimddk11Axg0mLfM=s176-c-k-c0x00ffffff-no-rj,0.0
Ugw-FY3XZTdPazeMGdd4AaABAg,Thank you~ have been watching your channel for couple of weeks ago and it's really make sense and it really help me through,8 個月前,lucy5 5 6 4 5 @ Gmail . com,UCsaRw0brUZ4QbkXM5HnPU7g,2,https://yt3.ggpht.com/hohB4wlDM68alMxXSIAvuhGPl1mbFlzb4FbB_CncciXai2jO5DIGDo3dmcoz2XYEdk4excDDeg=s176-c-k-c0x00ffffff-no-rj,0.0
Ugwb6lPwfHmVXfraY8x4AaABAg,"Ohh my one of the most informative video ever !!! 

So many ideas at one video 
Please include the time stamp... That makes it 10x easier to locate after 

You've got a new subscriber 🤗",8 個月前 (已編輯),Victor Vieira,UC05XcqFnPgfyBje7S8PGnzQ,0,https://yt3.ggpht.com/ytc/AKedOLQ2z0cbNosXxGd1qGVX_BLVbj6AjT5lzYTnzauZ4A=s176-c-k-c0x00ffffff-no-rj,0.0
UgxeseqFZ2et4ulSIkZ4AaABAg,Those were some great points. I should have thought of those in the Side Hustle video I made.,6 天前,Stephen Ethan,UCpBPrgzMblFvvOLmA6oEEBQ,0,https://yt3.ggpht.com/2Hq28gf3XpPfEkV33MeYhLS7JFm-oNjwHXaJmadS-CCOt_kfK85-y_pTtlB9QTvMCWaM4pgUdg=s176-c-k-c0x00ffffff-no-rj,0.0
UgxPUZGWJlQv3BSwqbt4AaABAg,Valuable information.  Appreciate you providing creative ideas that are profitable.   Thank you,8 個月前,Eric Nivo,UCD1DYxcLwgtzYpZf7LCjXGw,1,https://yt3.ggpht.com/MbMZsgbsBdp4rRrvf167CuVDzPBtckjX-gab3dIL5ZqlRaG6PzrbrJPmsP1lGGyTaryiV-S4=s176-c-k-c0x00ffffff-no-rj,0.0
Ugw7jDaOzjhPo3h3zEN4AaABAg,"You are amazing, Noah. Fortunate to find when you had less than 20K subscribers or something. Learnt a lot since.",8 個月前,Sidharth K,UC4eptxMqvpDcdjr_aK4pH0A,4,https://yt3.ggpht.com/ytc/AKedOLTOCKqmmip677LaxCiNEbtl0eK1CWaXJR5aUTY-dw=s176-c-k-c0x00ffffff-no-rj,0.0
UgxA74KbmQD030rTamx4AaABAg,Good video. I'm glad it has some different side hustles out there. Most side hustle vids or articles recycle the same things.,8 個月前,My Money Chronicles,UCu5C1y5rvb0Kw5SX6pS-jIg,2,https://yt3.ggpht.com/ytc/AKedOLR0y5OrqtFuxG_o8wyAQngL9csYoV79mWxzo8HG=s176-c-k-c0x00ffffff-no-rj,0.0
UgybZqjl06V1LlJic6F4AaABAg,"The more sources of income you have, the better off you'll be! That way if one source gets cut, you'll still have other sources to help you.",8 個月前,Alexa Madison,UCN8cIuRxwxmN8GGn0Hho6Fw,2,https://yt3.ggpht.com/cWABHP1HJ9yRz9_fnDqz2LkmS4gxaRAxhaBgWifUZzUtjZ2CeVWQbEEpHxOIqTxluMLCRpPtnw=s176-c-k-c0x00ffffff-no-rj,0.0
UgxLkDFgNado_K_7XCd4AaABAg,"Normally in commercial food businesses, including bakeries, you are legally required to bake your products in an oven that is not the same as your home oven where you cook and eat your own food. I.e., you have to rent a commercial oven somewhere. How does Facebook Marketplace get around that?",5 個月前,Clemdane,UC5Cs4-ghwY4OuI5bGKU5qfQ,0,https://yt3.ggpht.com/ytc/AKedOLRx1oClfbR8gwQwTXp9DG3Lgw7wRpdjiPtPUQ=s176-c-k-c0x00ffffff-no-rj,0.0
Ugw9jye1XXsTCvlyF0J4AaABAg,Realtors would pay so much if we could get really good email marketing vs ALL  junk we get.,7 個月前,Eric Girard - Realtor,UCWBAoU8CM5E_ELNPnh9lV-A,0,https://yt3.ggpht.com/ytc/AKedOLTYw7xXCJbVK8_-xqTyO9nDTQ1RtZzVPP39OwQ94A=s176-c-k-c0x00ffffff-no-rj,0.0
Ugz9slIqHY5OPh42nDN4AaABAg,Really interesting ideas!,6 個月前,Milla Katarina - Travel & Side Hustles,UCMQ_UuO1Fdgs01HkwdLBYmw,0,https://yt3.ggpht.com/DHQs-fO0ZDnk8q8PPXs-fTJATAFy1NcSRN3OJjPT_y1oNGkyVrTt_Wf7X6hT98wmhi5R-6Qwgg=s176-c-k-c0x00ffffff-no-rj,0.0
UgyCQ58juuUZvqEFZjR4AaABAg,Great content as well. Thanks man,8 個月前,INVESTOFY STOCK ALERTS,UCCZ39bWFwPyo8X45-dLEXDg,1,https://yt3.ggpht.com/ytc/AKedOLTHwv0x6GKqZrE7GWgiZjeWPpl7zJygeEPl7_pVPQ=s176-c-k-c0x00ffffff-no-rj,0.0
UgwsajUGIuICIR35jPJ4AaABAg,What are some things i could do to make income while traveling abroad? I'm american but currently in Indonesia with my wife. I'm not able to work here and things are financially tough here at the moment. Im desperate. Can anyone help or have any advice?,8 個月前,G0ATCLIPZ,UC3GweHOoTprKrnQKm_xmaaQ,2,https://yt3.ggpht.com/D9hS0zxOtNNqHZm4hd0kh_3IFXspynOSpXP-zX5m-pwJYXKqnUjUh_SdV-rblmUhrIvFhmRkcg=s176-c-k-c0x00ffffff-no-rj,0.0
Ugx3R9giS5Ny-dkFyfN4AaABAg,I love this video so much. I'll start upcycling and selling baked goods on FB marketplace.,8 個月前,Kevin Olega,UC9B3QMqYayimBRnKpWqq8-Q,2,https://yt3.ggpht.com/ytc/AKedOLQ2svlCUrRZZaBnaRic06JQDfWL87EJyR8Mct7f9w=s176-c-k-c0x00ffffff-no-rj,0.0
Ugz_SgSBbfhypkjyLhB4AaABAg,“From your phone” proceeds to talk about jobs where you need a car 😐😐😐😐,6 個月前,Simone Biles,UCwfjePOkNNk9K4uX4Wr4sBA,408,https://yt3.ggpht.com/ytc/AKedOLRD3gUids1_qW5w8ue6PHbb5NFNTb8h4n-0nh73uQ=s176-c-k-c0x00ffffff-no-rj,0.0
UgwGke0oOo-NU-A0oPN4AaABAg,"Love these videos and ideas!  This stuff can work.  My girlfriend and I started an eBay business with what we had in storage totes, and have turned it into a $3,000 per month gross sales business in less than 2 years.  Best part is it cost us nothing to start.  Also, we started cleaning house rentals and charge a flat rate, usually making $100-200 per hour for the 2 of us.   Would love to turn our knowledge of reselling into an online consulting money maker.  Next goal.",7 個月前,Scott Windau,UClcwkQ4B5S2OJyMeJ_IXqJA,164,https://yt3.ggpht.com/ytc/AKedOLRTzCW-fZPi3ckAM4YkK7XL_P9TZjD_uM7kH7I4RQ=s176-c-k-c0x00ffffff-no-rj,0.0
UgxUfBkFwEeIlMY6h1x4AaABAg,As a European it's just baffling to see how many side hustles are possible in the usa. I'd just like to go to garage sales and flip some things but nobody does anything like this where I live lol,5 個月前,Scythe,UC3xhmRJPfc689W2vgcrULJA,18,https://yt3.ggpht.com/_CXuvGluZ9ql633t22hLOIn-qdu4HeQja5SFB_JD24XPlYz1bE5RmnJVWuBRuTP_n6vluN-TFQ=s176-c-k-c0x00ffffff-no-rj,0.0
UgzCwBRbmCSa8UBuTgx4AaABAg,"These are great tips!  I work from home and on the side watch dogs on Rover because I used them for my dog and liked the idea of my dog staying at someone's home.  It wasn't meant to be a huge source of extra income, but because of the pandemic, me living in a hot area and people ready to travel, I made over $10,000 in one month while working my regular job and other side projects.  I had to raise my prices so high to get less business and just keep the dogs I love having.  My goal is to make way less than that and just have 1 or 2 dogs at a time.",7 個月前,Success with Stacee,UCACVWUW6iMtcRmNg7iRi3KQ,51,https://yt3.ggpht.com/ytc/AKedOLR0AiIJ_1DHyeE0b11ndXisvQiKGeJDm_YcQXR-KpU=s176-c-k-c0x00ffffff-no-rj,0.0
UgzI7xVC7lAbMKwI8B54AaABAg,"You always come up with the greatest ideas for side hustles, Noah! Amazing video.👌",8 個月前,Marketing Harry,UC8bbeohnLzmsGPklJCSFpRQ,43,https://yt3.ggpht.com/ytc/AKedOLRln_BhMvQOXWSBIi9D3k5HZrXI-ayGBJWdJQmz=s176-c-k-c0x00ffffff-no-rj,0.0
UgznVpibExMEMULDikR4AaABAg,"Most people venture into crypto to be millionaires, meanwhile i just want to be debt free",6 天前,Patience Oluchi,UC9uvcSik0AVSTxGk--a5gMA,20,https://yt3.ggpht.com/ytc/AKedOLTPYRq6qin1lDoLXDBlZ5Xdja9cQYqraYEDtA=s176-c-k-c0x00ffffff-no-rj,0.0
UgyAbiLq0J__5PjkC_F4AaABAg,"Semi-retired, looking for side hustles that are more WFH. But this helps. Thank you for sharing your ideas.",6 個月前,Adrien Chandler,UCzvX3BpbR6ygbLdDwTBUtnQ,27,https://yt3.ggpht.com/ytc/AKedOLSyG90pF7-u13zKVUiztNB92y4R2uPlYmNXXg=s176-c-k-c0x00ffffff-no-rj,0.0
UgxCHumkYOdy-53cRDN4AaABAg,"I'm being a guinea pig for the Field Agent app.  So far I would say it is only worthwhile doing if you already plan to go to the store and/or are planning to buy a product they want you to ""test"" or whatever.  For my first gig, I will net profit of negative $5.  Cost of laundry detergent was about $10.  Gig paid a total of $5.  But, I got laundry detergent at half price.  If they want you to take a photo of a product you have to take around 6-8 photos.... which could be all 6 sides of a product (front, back, sides, top & bottom) as well as the shelf and perhaps the aisle.  The tough part about this is how to do it without looking suspect.  I'm going to try to make $100 with it and perhaps I'll do a full review later :D",8 個月前 (已編輯),Coconut Pete,UCPcAPHeZ2l9QAWbH4nB64-Q,45,https://yt3.ggpht.com/ytc/AKedOLR4xCBEEtC7r27hqggceTkZOn9dd3ZUAFbUUegwKmw=s176-c-k-c0x00ffffff-no-rj,0.0
Ugx5GDeS5SAbBYn1X194AaABAg,I bought your course on the $1000 extra a month and started a boat detailing business and pocketed 100k in my first year - thanks Noah - it really is getting off your arse and NOT being afraid of rejection - it does happen but that's part of it !!!,7 個月前,rob barense,UCScRODE6DYrkhVI9tSjosIw,91,https://yt3.ggpht.com/ytc/AKedOLTKC4X96i4BirEI8gzr4uHgv-jzlqoRsU_60A=s176-c-k-c0x00ffffff-no-rj,1.0
Ugx6Ej3OvP9c9Uvjn-94AaABAg,I get so many ideas and insane motivation just from hearing how you view the world! Love it,2 個月前,Viktor Sahlgren,UC34YUAdhaLY8ZxdXnax-bVw,2,https://yt3.ggpht.com/ytc/AKedOLSgfKjNShQsWRepvOe2teBvI7LfR8gcvKtWxEhL4w=s176-c-k-c0x00ffffff-no-rj,0.0
UgyXOHxd1AxlHv30ZZx4AaABAg,I don’t ever comment on videos but this one was pretty awesome. I’m trying to come up with ideas as I write this… while I’m at work haha thank you for this Noah. I really appreciate this video a lot,8 個月前,Zachary Rockhill,UCPbWVCtJHCYImCMbD5HMUPQ,51,https://yt3.ggpht.com/ytc/AKedOLQoEpchY6rBRqjEikCiHGFTfmgFoCiqt8PP0Qzfbw=s176-c-k-c0x00ffffff-no-rj,1.0
Ugz4MCVv7SApnFW54Gh4AaABAg,Thank you guys for uploading this great opportunity for all great ideas I love it 👍👍,6 個月前,sessie conteh,UCT8jmJtKm1CQyYctyF4Zamw,3,https://yt3.ggpht.com/64LX_HVnUf89V93xY3DOSfGyJ-PPQrA6RlOo-58VCKH7YbOJcQbn5Lflr2lUT7Tg_kbtayn7sQ=s176-c-k-c0x00ffffff-no-rj,0.0
UgxSbzrgTHPVUdqrDg14AaABAg,"One thing about online food delivery is if you plan on delivering on a bicycle, many companies still require a driver's license.",6 個月前,kyrios*dinjir,UCagHHq_lc17Vnrz8Bd6Dl9A,13,https://yt3.ggpht.com/ytc/AKedOLRlRjxdAc1f42wcmF6uGEgwcGhWl1FT-Yb1uGgTpA=s176-c-k-c0x00ffffff-no-rj,0.0
UgyDS5LVX3XhrNjOKCx4AaABAg,I can't lie. You motivated me to start my own channel and now we headed somewhere 💫🙂🙏,8 個月前,Walk With Me WWM,UCrFyrErhQqY8g8N6QH3Rc7w,25,https://yt3.ggpht.com/EL3JEanVsuYZMpSqh2wJzAu7iRGEHjKyURW7qwUCt7-u5qQjx1wrD09aprQAV-POmNSRpYYL8B0=s176-c-k-c0x00ffffff-no-rj,0.0
